{
  "contract": "quantum.train_pose",
  "version": 1,
  "leadDistance": 21.5,
  "definition": {
    "carCount": 1,
    "carSpacing": 3.25,
    "carGeometry": {
      "length": 4.5,
      "width": 1.8,
      "height": 2.1
    },
    "bogieLayout": {
      "bogieSpacing": 2.75
    },
    "wheelLayout": {
      "wheelCountPerBogie": 2,
      "wheelRadius": 0.45,
      "wheelWidth": 0.25,
      "axleSpacing": 1.1
    }
  },
  "cars": [
    {
      "body": {
        "originalBody": {
          "carIndex": 0,
          "distance": 20,
          "frame": {
            "distance": 20,
            "position": {
              "x": 1,
              "y": 2,
              "z": 3
            },
            "tangent": {
              "x": 1,
              "y": 0,
              "z": 0
            },
            "normal": {
              "x": 0,
              "y": 1,
              "z": 0
            },
            "binormal": {
              "x": 0,
              "y": 0,
              "z": 1
            }
          },
          "matrix": {
            "m11": 11,
            "m12": 12,
            "m13": 13,
            "m14": 14,
            "m21": 15,
            "m22": 16,
            "m23": 17,
            "m24": 18,
            "m31": 19,
            "m32": 20,
            "m33": 21,
            "m34": 22,
            "m41": 23,
            "m42": 24,
            "m43": 25,
            "m44": 26
          }
        },
        "frontBogie": {
          "carIndex": 0,
          "bogieIndex": 0,
          "distance": 21.25,
          "frame": {
            "distance": 21.25,
            "position": {
              "x": 101,
              "y": 102,
              "z": 103
            },
            "tangent": {
              "x": 1,
              "y": 0,
              "z": 0
            },
            "normal": {
              "x": 0,
              "y": 1,
              "z": 0
            },
            "binormal": {
              "x": 0,
              "y": 0,
              "z": 1
            }
          },
          "matrix": {
            "m11": 101,
            "m12": 102,
            "m13": 103,
            "m14": 104,
            "m21": 105,
            "m22": 106,
            "m23": 107,
            "m24": 108,
            "m31": 109,
            "m32": 110,
            "m33": 111,
            "m34": 112,
            "m41": 113,
            "m42": 114,
            "m43": 115,
            "m44": 116
          }
        },
        "rearBogie": {
          "carIndex": 0,
          "bogieIndex": 1,
          "distance": 18.75,
          "frame": {
            "distance": 18.75,
            "position": {
              "x": 201,
              "y": 202,
              "z": 203
            },
            "tangent": {
              "x": 1,
              "y": 0,
              "z": 0
            },
            "normal": {
              "x": 0,
              "y": 1,
              "z": 0
            },
            "binormal": {
              "x": 0,
              "y": 0,
              "z": 1
            }
          },
          "matrix": {
            "m11": 201,
            "m12": 202,
            "m13": 203,
            "m14": 204,
            "m21": 205,
            "m22": 206,
            "m23": 207,
            "m24": 208,
            "m31": 209,
            "m32": 210,
            "m33": 211,
            "m34": 212,
            "m41": 213,
            "m42": 214,
            "m43": 215,
            "m44": 216
          }
        },
        "articulatedFrame": {
          "distance": 20.5,
          "position": {
            "x": 4,
            "y": 5,
            "z": 6
          },
          "tangent": {
            "x": 1,
            "y": 0,
            "z": 0
          },
          "normal": {
            "x": 0,
            "y": 1,
            "z": 0
          },
          "binormal": {
            "x": 0,
            "y": 0,
            "z": 1
          }
        },
        "articulatedMatrix": {
          "m11": 501,
          "m12": 502,
          "m13": 503,
          "m14": 504,
          "m21": 505,
          "m22": 506,
          "m23": 507,
          "m24": 508,
          "m31": 509,
          "m32": 510,
          "m33": 511,
          "m34": 512,
          "m41": 513,
          "m42": 514,
          "m43": 515,
          "m44": 516
        },
        "centerDistance": 20.5
      },
      "frontBogie": {
        "bogie": {
          "carIndex": 0,
          "bogieIndex": 0,
          "distance": 21.25,
          "frame": {
            "distance": 21.25,
            "position": {
              "x": 101,
              "y": 102,
              "z": 103
            },
            "tangent": {
              "x": 1,
              "y": 0,
              "z": 0
            },
            "normal": {
              "x": 0,
              "y": 1,
              "z": 0
            },
            "binormal": {
              "x": 0,
              "y": 0,
              "z": 1
            }
          },
          "matrix": {
            "m11": 101,
            "m12": 102,
            "m13": 103,
            "m14": 104,
            "m21": 105,
            "m22": 106,
            "m23": 107,
            "m24": 108,
            "m31": 109,
            "m32": 110,
            "m33": 111,
            "m34": 112,
            "m41": 113,
            "m42": 114,
            "m43": 115,
            "m44": 116
          }
        },
        "wheels": [
          {
            "carIndex": 0,
            "bogieIndex": 0,
            "wheelIndex": 0,
            "localOffsetX": -0.35,
            "localOffsetY": 0,
            "localOffsetZ": 0.8,
            "frame": {
              "distance": 21.25,
              "position": {
                "x": 101,
                "y": 102,
                "z": 103
              },
              "tangent": {
                "x": 1,
                "y": 0,
                "z": 0
              },
              "normal": {
                "x": 0,
                "y": 1,
                "z": 0
              },
              "binormal": {
                "x": 0,
                "y": 0,
                "z": 1
              }
            },
            "matrix": {
              "m11": 101.1,
              "m12": 102.1,
              "m13": 103.1,
              "m14": 104.1,
              "m21": 105.1,
              "m22": 106.1,
              "m23": 107.1,
              "m24": 108.1,
              "m31": 109.1,
              "m32": 110.1,
              "m33": 111.1,
              "m34": 112.1,
              "m41": 113.1,
              "m42": 114.1,
              "m43": 115.1,
              "m44": 116.1
            }
          },
          {
            "carIndex": 0,
            "bogieIndex": 0,
            "wheelIndex": 1,
            "localOffsetX": 0.35,
            "localOffsetY": 0,
            "localOffsetZ": 0.8,
            "frame": {
              "distance": 21.25,
              "position": {
                "x": 101,
                "y": 102,
                "z": 103
              },
              "tangent": {
                "x": 1,
                "y": 0,
                "z": 0
              },
              "normal": {
                "x": 0,
                "y": 1,
                "z": 0
              },
              "binormal": {
                "x": 0,
                "y": 0,
                "z": 1
              }
            },
            "matrix": {
              "m11": 101.2,
              "m12": 102.2,
              "m13": 103.2,
              "m14": 104.2,
              "m21": 105.2,
              "m22": 106.2,
              "m23": 107.2,
              "m24": 108.2,
              "m31": 109.2,
              "m32": 110.2,
              "m33": 111.2,
              "m34": 112.2,
              "m41": 113.2,
              "m42": 114.2,
              "m43": 115.2,
              "m44": 116.2
            }
          }
        ]
      },
      "rearBogie": {
        "bogie": {
          "carIndex": 0,
          "bogieIndex": 1,
          "distance": 18.75,
          "frame": {
            "distance": 18.75,
            "position": {
              "x": 201,
              "y": 202,
              "z": 203
            },
            "tangent": {
              "x": 1,
              "y": 0,
              "z": 0
            },
            "normal": {
              "x": 0,
              "y": 1,
              "z": 0
            },
            "binormal": {
              "x": 0,
              "y": 0,
              "z": 1
            }
          },
          "matrix": {
            "m11": 201,
            "m12": 202,
            "m13": 203,
            "m14": 204,
            "m21": 205,
            "m22": 206,
            "m23": 207,
            "m24": 208,
            "m31": 209,
            "m32": 210,
            "m33": 211,
            "m34": 212,
            "m41": 213,
            "m42": 214,
            "m43": 215,
            "m44": 216
          }
        },
        "wheels": [
          {
            "carIndex": 0,
            "bogieIndex": 1,
            "wheelIndex": 0,
            "localOffsetX": -0.35,
            "localOffsetY": 0,
            "localOffsetZ": 0.8,
            "frame": {
              "distance": 18.75,
              "position": {
                "x": 201,
                "y": 202,
                "z": 203
              },
              "tangent": {
                "x": 1,
                "y": 0,
                "z": 0
              },
              "normal": {
                "x": 0,
                "y": 1,
                "z": 0
              },